[
  {
    "id": "gambeson_armor",
    "name": {
      "en-US": "Gambeson Armor"
    },
    "tier": 1,
    "baseMajorThreshold": 5,
    "baseSevereThreshold": 11,
    "baseScore": 3,
    "features": [
      {
        "name": {
          "en-US": "Flexible"
        },
        "description": [
          {
            "type": "PARAGRAPH",
            "text": {
              "en-US": "+1 to Evasion"
            }
          }
        ]
      }
    ]
  },
  {
    "id": "leather_armor",
    "name": {
      "en-US": "Leather Armor"
    },
    "tier": 1,
    "baseMajorThreshold": 6,
    "baseSevereThreshold": 13,
    "baseScore": 3
  },
  {
    "id": "chainmail_armor",
    "name": {
      "en-US": "Chainmail Armor"
    },
    "tier": 1,
    "baseMajorThreshold": 7,
    "baseSevereThreshold": 15,
    "baseScore": 4,
    "features": [
      {
        "name": {
          "en-US": "Heavy"
        },
        "description": [
          {
            "type": "PARAGRAPH",
            "text": {
              "en-US": "-1 to Evasion"
            }
          }
        ]
      }
    ]
  },
  {
    "id": "full_plate_armor",
    "name": {
      "en-US": "Full Plate Armor"
    },
    "tier": 1,
    "baseMajorThreshold": 8,
    "baseSevereThreshold": 17,
    "baseScore": 4,
    "features": [
      {
        "name": {
          "en-US": "Very Heavy"
        },
        "description": [
          {
            "type": "PARAGRAPH",
            "text": {
              "en-US": "-2 to Evasion; -1 to Agility"
            }
          }
        ]
      }
    ]
  },
  {
    "id": "improved_gambeson_armor",
    "name": {
      "en-US": "Improved Gambeson Armor"
    },
    "tier": 2,
    "baseMajorThreshold": 7,
    "baseSevereThreshold": 16,
    "baseScore": 4,
    "features": [
      {
        "name": {
          "en-US": "Flexible"
        },
        "description": [
          {
            "type": "PARAGRAPH",
            "text": {
              "en-US": "+1 to Evasion"
            }
          }
        ]
      }
    ]
  },
  {
    "id": "improved_leather_armor",
    "name": {
      "en-US": "Improved Leather Armor"
    },
    "tier": 2,
    "baseMajorThreshold": 9,
    "baseSevereThreshold": 20,
    "baseScore": 4
  },
  {
    "id": "improved_chainmail_armor",
    "name": {
      "en-US": "Improved Chainmail Armor"
    },
    "tier": 2,
    "baseMajorThreshold": 11,
    "baseSevereThreshold": 24,
    "baseScore": 5,
    "features": [
      {
        "name": {
          "en-US": "Heavy"
        },
        "description": [
          {
            "type": "PARAGRAPH",
            "text": {
              "en-US": "-1 to Evasion"
            }
          }
        ]
      }
    ]
  },
  {
    "id": "improved_full_plate_armor",
    "name": {
      "en-US": "Improved Full Plate Armor"
    },
    "tier": 2,
    "baseMajorThreshold": 13,
    "baseSevereThreshold": 28,
    "baseScore": 5,
    "features": [
      {
        "name": {
          "en-US": "Very Heavy"
        },
        "description": [
          {
            "type": "PARAGRAPH",
            "text": {
              "en-US": "-2 to Evasion; -1 to Agility"
            }
          }
        ]
      }
    ]
  },
  {
    "id": "elundrian_chain_armor",
    "name": {
      "en-US": "Elundrian Chain Armor"
    },
    "tier": 2,
    "baseMajorThreshold": 9,
    "baseSevereThreshold": 21,
    "baseScore": 4,
    "features": [
      {
        "name": {
          "en-US": "Warded"
        },
        "description": [
          {
            "type": "PARAGRAPH",
            "text": {
              "en-US": "You reduce incoming magic damage by your Armor Score before applying it to your damage thresholds."
            }
          }
        ]
      }
    ]
  },
  {
    "id": "harrowbone_armor",
    "name": {
      "en-US": "Harrowbone Armor"
    },
    "tier": 2,
    "baseMajorThreshold": 9,
    "baseSevereThreshold": 21,
    "baseScore": 4,
    "features": [
      {
        "name": {
          "en-US": "Resilient"
        },
        "description": [
          {
            "type": "PARAGRAPH",
            "text": {
              "en-US": "Before you mark your last Armor Slot, roll a d6. On a result of 6, reduce the severity by one threshold without marking an Armor Slot."
            }
          }
        ]
      }
    ]
  },
  {
    "id": "irontree_breastplate_armor",
    "name": {
      "en-US": "Irontree Breastplate Armor"
    },
    "tier": 2,
    "baseMajorThreshold": 9,
    "baseSevereThreshold": 20,
    "baseScore": 4,
    "features": [
      {
        "name": {
          "en-US": "Reinforced"
        },
        "description": [
          {
            "type": "PARAGRAPH",
            "text": {
              "en-US": "When you mark your last Armor Slot, increase your damage thresholds by +2 until you clear at least 1 Armor Slot."
            }
          }
        ]
      }
    ]
  },
  {
    "id": "runetan_floating_armor",
    "name": {
      "en-US": "Runetan Floating Armor"
    },
    "tier": 2,
    "baseMajorThreshold": 9,
    "baseSevereThreshold": 20,
    "baseScore": 4,
    "features": [
      {
        "name": {
          "en-US": "Shifting"
        },
        "description": [
          {
            "type": "PARAGRAPH",
            "text": {
              "en-US": "When you are targeted for an attack, you can mark an Armor Slot to give the attack roll against you disadvantage."
            }
          }
        ]
      }
    ]
  },
  {
    "id": "tyris_soft_armor",
    "name": {
      "en-US": "Tyris Soft Armor"
    },
    "tier": 2,
    "baseMajorThreshold": 8,
    "baseSevereThreshold": 18,
    "baseScore": 5,
    "features": [
      {
        "name": {
          "en-US": "Quiet"
        },
        "description": [
          {
            "type": "PARAGRAPH",
            "text": {
              "en-US": "You gain a +2 bonus to rolls you make to move silently."
            }
          }
        ]
      }
    ]
  },
  {
    "id": "rosewild_armor",
    "name": {
      "en-US": "Rosewild Armor"
    },
    "tier": 2,
    "baseMajorThreshold": 11,
    "baseSevereThreshold": 23,
    "baseScore": 5,
    "features": [
      {
        "name": {
          "en-US": "Hopeful"
        },
        "description": [
          {
            "type": "PARAGRAPH",
            "text": {
              "en-US": "When you would spend a Hope, you can mark an Armor Slot instead."
            }
          }
        ]
      }
    ]
  },
  {
    "id": "advanced_gambeson_armor",
    "name": {
      "en-US": "Advanced Gambeson Armor"
    },
    "tier": 3,
    "baseMajorThreshold": 9,
    "baseSevereThreshold": 23,
    "baseScore": 5,
    "features": [
      {
        "name": {
          "en-US": "Flexible"
        },
        "description": [
          {
            "type": "PARAGRAPH",
            "text": {
              "en-US": "+1 to Evasion"
            }
          }
        ]
      }
    ]
  },
  {
    "id": "advanced_leather_armor",
    "name": {
      "en-US": "Advanced Leather Armor"
    },
    "tier": 3,
    "baseMajorThreshold": 11,
    "baseSevereThreshold": 27,
    "baseScore": 5
  },
  {
    "id": "advanced_chainmail_armor",
    "name": {
      "en-US": "Advanced Chainmail Armor"
    },
    "tier": 3,
    "baseMajorThreshold": 13,
    "baseSevereThreshold": 31,
    "baseScore": 6,
    "features": [
      {
        "name": {
          "en-US": "Heavy"
        },
        "description": [
          {
            "type": "PARAGRAPH",
            "text": {
              "en-US": "-1 to Evasion"
            }
          }
        ]
      }
    ]
  },
  {
    "id": "advanced_full_plate_armor",
    "name": {
      "en-US": "Advanced Full Plate Armor"
    },
    "tier": 3,
    "baseMajorThreshold": 15,
    "baseSevereThreshold": 35,
    "baseScore": 6,
    "features": [
      {
        "name": {
          "en-US": "Very Heavy"
        },
        "description": [
          {
            "type": "PARAGRAPH",
            "text": {
              "en-US": "-2 to Evasion; -1 to Agility"
            }
          }
        ]
      }
    ]
  },
  {
    "id": "bellamoi_fine_armor",
    "name": {
      "en-US": "Bellamoi Fine Armor"
    },
    "tier": 3,
    "baseMajorThreshold": 11,
    "baseSevereThreshold": 27,
    "baseScore": 5,
    "features": [
      {
        "name": {
          "en-US": "Gilded"
        },
        "description": [
          {
            "type": "PARAGRAPH",
            "text": {
              "en-US": "+1 to Presence"
            }
          }
        ]
      }
    ]
  },
  {
    "id": "dragonscale_armor",
    "name": {
      "en-US": "Dragonscale Armor"
    },
    "tier": 3,
    "baseMajorThreshold": 11,
    "baseSevereThreshold": 27,
    "baseScore": 5,
    "features": [
      {
        "name": {
          "en-US": "Impenetrable"
        },
        "description": [
          {
            "type": "PARAGRAPH",
            "text": {
              "en-US": "Once per short rest, when you would mark your last Hit Point, you can instead mark a Stress."
            }
          }
        ]
      }
    ]
  },
  {
    "id": "spiked_plate_armor",
    "name": {
      "en-US": "Spiked Plate Armor"
    },
    "tier": 3,
    "baseMajorThreshold": 10,
    "baseSevereThreshold": 25,
    "baseScore": 5,
    "features": [
      {
        "name": {
          "en-US": "Sharp"
        },
        "description": [
          {
            "type": "PARAGRAPH",
            "text": {
              "en-US": "On a successful attack against a target within Melee range, add a d4 to the damage roll."
            }
          }
        ]
      }
    ]
  },
  {
    "id": "bladefare_armor",
    "name": {
      "en-US": "Bladefare Armor"
    },
    "tier": 3,
    "baseMajorThreshold": 16,
    "baseSevereThreshold": 39,
    "baseScore": 6,
    "features": [
      {
        "name": {
          "en-US": "Physical"
        },
        "description": [
          {
            "type": "PARAGRAPH",
            "text": {